{
  "schema_version": "1.1.0",
  "mode_source": "cognitive-sensor",
  "mode": "BUILD",
  "build_allowed": true,
  "primary_action": "Create freely.",
  "open_loops": [
    "Universal Programming Table Setup"
  ],
  "open_loop_count": 1,
  "closure_ratio": 95.45,
  "risk": "LOW",
  "generated_at": "2026-04-14",
  "predictions": {
    "status": "unavailable",
    "top_actions": [],
    "pattern_count": 0,
    "mode_forecast": null,
    "exit_path": null
  }
}